titles,interviewee,url
摩奇园林专访：土壤生态功能提升新变革与绿化废弃物循环产业...,受访 史军鹏（全国城镇风景园林标委会委员 、 中国风景园林学会企业工作委员会...,http://www.chinabuildingcentre.com/show-41-747-1.html
实现环境的可持续发展——UED杂志专访邓代明,受访 邓代明 棕榈设计有限公司常务副总裁UED：在国家新型城镇化的大背景之下，生...,http://www.chinabuildingcentre.com/show-41-743-1.html
平凡坚毅中的建筑传承——UED杂志专访李子萍,采访对象：李子萍，中国建筑西北设计研究院有限公司专业总建筑师采访媒体：《城市...,http://www.chinabuildingcentre.com/show-41-742-1.html
董功专访：建筑作为一种呈现的媒介,建筑作为一种呈现的媒介,http://www.chinabuildingcentre.com/show-41-741-1.html
waa专访：言说|量体裁衣的裁缝与叙事性的建筑,受访／张迪 杨杰克 博乐文,http://www.chinabuildingcentre.com/show-41-739-1.html
WOHA专访：不断发现有新意且可持续发展的解决方案,受访／黄文森（Wong Mun Summ）、理查德·哈塞尔（Richard Hassell） WOHA 建筑事务所创始合伙人,http://www.chinabuildingcentre.com/show-41-738-1.html
【专访】伊纳克·阿巴罗斯: 实用主义的人文商业情怀,“现在已经不是看哪栋楼建的最高，而是要看里面的人如何生活在高处。”,http://www.chinabuildingcentre.com/show-41-737-1.html
【专访】丹尼尔·里伯斯金: 当艺术遇见商业,“我相信只有当建筑师动手画，才会拥有普鲁斯特经历的那种时刻——碰巧走到心灵的...,http://www.chinabuildingcentre.com/show-41-736-1.html
金陵美术馆 | 以“工业厂房”为起点，以“工业材料”为终点,金陵美术馆是20世纪60-70年代的工业厂房改建，它仿佛一位在场的他者悄然矗立在南京...,http://www.chinabuildingcentre.com/show-41-735-1.html
华黎：地 · 景中的建筑 | UED百名建筑师展,华黎：地 · 景中的建筑 | UED百名建筑师展地 · 景中的建筑Building in L...,http://www.chinabuildingcentre.com/show-41-734-1.html
从表绿到深绿——作为绿色建筑产业化引领者的深度思考与探索,走进天友集团位于天津的绿色设计中心，迎面而来的是鲤鱼水景和透光性极强的大空间...,http://www.chinabuildingcentre.com/show-41-733-1.html
【为城市而设计·艺术改变城市】王中：郑州1904公园,案例的意义并不在于项目本身，而在于我们提出“艺术激活空间”主张的落地实践。事...,http://www.chinabuildingcentre.com/show-41-732-1.html
【为城市而设计·智慧城市】巴塞罗那建筑面面观,访谈来自《城市 环境 设计》（UED）杂志第95期 2015年9月刊。主持人：里卡德·...,http://www.chinabuildingcentre.com/show-41-731-1.html
【为城市而设计·景观城市】野趣· 野去,每一个在城市里忙忙碌碌穿梭于鳞次栉比的钢筋水泥中的人都有一个身在郊野的梦，而...,http://www.chinabuildingcentre.com/show-41-730-1.html
单军：建筑应当关注地域性【从北京到伦敦展】访谈,采访   王鑫（UED）（原载于《UED》，2012（08） 从北京到伦敦——当代中国建...,http://www.chinabuildingcentre.com/show-41-729-1.html
单军：关键不在于是否在境外盖房子【境外实践专辑】访谈,采访：范路（原载于《世界建筑》，2015（01） 建在别处境外实践专辑）中国建筑师...,http://www.chinabuildingcentre.com/show-41-728-1.html
单军对话王路：之间,关于钟祥市博物馆暨明代帝王文化博物馆设计单军 王路（原载于《时代建筑》，2013...,http://www.chinabuildingcentre.com/show-41-727-1.html
内外之间,——建筑地点性表达的两种途径单 军 铁 雷(原载于《世界建筑》，2010(08)) 建...,http://www.chinabuildingcentre.com/show-41-726-1.html
春秋之间,——春秋双门单军铁雷（原载于《建筑学报》，2010(11)）            ...,http://www.chinabuildingcentre.com/show-41-725-1.html
山水之间,——钟祥市博物馆暨明代帝王文化博物馆设计单军，卢向东，王鑫，铁雷（原载于《建...,http://www.chinabuildingcentre.com/show-41-724-1.html
飞地的双重地域性,——中国商务部驻印尼商务馆舍设计单军 刘玉龙 铁雷 赵瞳（原载于《建筑学报》...,http://www.chinabuildingcentre.com/show-41-723-1.html
《地区建筑学系列研究丛书》缘起,单军（原载于《地区建筑学系列研究丛书》，2014）谈到地区建筑学系列研究的缘起，...,http://www.chinabuildingcentre.com/show-41-722-1.html
[UED]城市与未来——庞嵚－建筑纪元专访,2015年7月2日建筑纪元展于上海展览中心举办，Benoy上海区总经理庞嵚受邀参加，并进...,http://www.chinabuildingcentre.com/show-41-721-1.html
广东博物馆新馆太丑？主设计师严迅奇回应三大争议,开放不到半个月的广东博物馆，已经成为广州城内最受关注的一栋明星建筑，每天都吸...,http://www.chinabuildingcentre.com/show-41-720-1.html
上完这一课，全世界都会听你的——设计公司产品创新Workshop,引言设计企业业绩大滑坡！设计人的自我角色迷失！好日子过去了，我们很怀念它。如...,http://www.chinabuildingcentre.com/show-41-719-1.html
陈阳谈产品创新：抓住从0到1的机会（下）,引言当下设计行业的市场有所变化，设计企业面临各样的问题，企业的管理思维提升以...,http://www.chinabuildingcentre.com/show-41-718-1.html
陈阳谈产品创新：抓住从0到1的机会（上）,引言当下设计行业的市场有所变化，设计企业面临各样的问题，企业的管理思维提升以...,http://www.chinabuildingcentre.com/show-41-717-1.html
演艺建筑：使每个人都参与到艺术中来——Aedas 文化艺术团队专访,中国建筑报道网专访Aedas 文化艺术团队主题：演艺建筑——使每个人都参与到艺术中...,http://www.chinabuildingcentre.com/show-41-716-1.html
设计企业不要错过从0到1的机会——CBC学院专访ADU首席顾问陈阳老师,——CBC学院专访ADU首席顾问陈阳老师采访主题：市场现状与目前设计企业的发展之路...,http://www.chinabuildingcentre.com/show-41-715-1.html
为何古罗马建筑可以屹立上千年不倒,"古罗马建筑为何能上千年屹立不倒利用ALS光束线12 3 2,一种超导体弯曲磁铁X射线微...",http://www.chinabuildingcentre.com/show-41-714-1.html
【视频】UED深圳华汇大讲堂——蓝天组prix深圳讲座,2014年11月19日，奥地利蓝天组创始人Wolf D  Prix莅临“UED深圳华汇大讲堂”，...,http://www.chinabuildingcentre.com/show-41-713-1.html
【视频】UED深圳华汇大讲堂——理查德·瑞杰斯特：未来城市—...,由UED杂志社、深圳华汇设计有限公司、万科集团以及C&P国际生态技术研究院联合主办...,http://www.chinabuildingcentre.com/show-41-712-1.html
【视频】UED深圳华汇大讲堂——哈尼·拉什德：形式追随未来,美国知名建筑师哈尼·拉什德，受由《城市·环境·设计》（UED）杂志社、深圳华汇设...,http://www.chinabuildingcentre.com/show-41-711-1.html
【视频】UED大师讲堂——承孝相：地文,2014年6月6日，韩国知名建筑师承孝相，受由《城市·环境·设计》（UED）杂志社、深...,http://www.chinabuildingcentre.com/show-41-710-1.html
【视频】UED大师讲堂——布兰登·麦克法兰“场所与身份”,2014年4月25日晚，UED大师讲堂-布兰登·麦克法兰“场所与身份”讲座在深圳华夏艺术...,http://www.chinabuildingcentre.com/show-41-709-1.html
【视频】UED大师讲堂——汤姆·梅恩(Thom Mayne),汤姆·梅恩以“公共精神(Public-ness)”为主题，结合十多个案例，分享了自己对于城...,http://www.chinabuildingcentre.com/show-41-708-1.html
【视频】UED大师讲堂—丹尼尔里伯斯金：建筑是一种语言,美籍犹太裔丹尼尔 里伯斯金(Daniel Libeskind)1946年出生于波兰一个纳粹大屠杀幸...,http://www.chinabuildingcentre.com/show-41-706-1.html
面向未来的产业园景观设计·阿普贝思邹裕波总裁-实战培训回访交流,快速化的城市建设横生出诸多建设项目。作为维持企业运转的支撑点，项目的魅力令人...,http://www.chinabuildingcentre.com/show-41-693-1.html
蓝天组Prix访谈：建筑可以像云一样,UED：请问您的事务所为何叫做蓝天组(CoopHimmelb(l)au)？您的建筑设计风格与蓝天有...,http://www.chinabuildingcentre.com/show-41-690-1.html
包赞巴克的摩天楼情结：纽约高层设计,除了文化类的建筑项目，摩天大楼也是克里斯蒂安&bull;德&bull;包赞巴克设计实践的...,http://www.chinabuildingcentre.com/show-41-689-1.html
包赞巴克：让空间变得快乐起来,曾经有人形容，和自己的建筑设计相比，法国建筑师克里斯蒂安 德 包赞巴克(Christ...,http://www.chinabuildingcentre.com/show-41-688-1.html
充满梦幻的埃尔热丁丁博物馆,丁丁历险记的作者埃尔热先生的夫人Fanny Rodwell 希望建一座博物馆来纪念他的丈...,http://www.chinabuildingcentre.com/show-41-687-1.html
来自普利兹克奖的赞誉——包赞巴克的巴黎音乐城,巴黎音乐城项目是克里斯蒂安&bull;德&bull;包赞巴克先生最重要的代表作之一，与其...,http://www.chinabuildingcentre.com/show-41-686-1.html
坚持做事“不糊弄”——专访DDON•笛东总裁兼首席设计师袁松亭,撰稿：UED 苏倩DDON·笛东经过短短6年的时间，已然发展为中国设计界一支异军突起...,http://www.chinabuildingcentre.com/show-41-685-1.html
伊东丰雄：超越现代主义建筑,文 婷玉拆东西，有人称之为解析彩虹。可人们就是放弃了感性与想象力，甘愿囚禁于...,http://www.chinabuildingcentre.com/show-41-684-1.html
用心是献给读者最好的礼物：UED荣获“中国最美期刊”称号,在刚刚结束的2014年度中国最美期刊遴选活动中，《城市环境设计》杂志（UED），荣幸...,http://www.chinabuildingcentre.com/show-41-683-1.html
萌萌哒建筑师与汪星人,无印良品的设计总监，设计师原研哉先生邀请了十二组建筑师为汪星人设计专属的空间...,http://www.chinabuildingcentre.com/show-41-682-1.html
“与鸟为伴”——槃达建筑 AIM野奢传奇帐篷酒店竞赛方案,针对帐篷酒店竞赛方案，我们基于三个核心理念：一个生态可持续的项目；一个灵活开...,http://www.chinabuildingcentre.com/show-41-681-1.html
脑洞大开！僵尸避难所建筑设计大赛作品搜集,建筑设计公司Architects Southwest 于2010年发起了第一届僵尸避难所设计大赛，没...,http://www.chinabuildingcentre.com/show-41-680-1.html
转回去临摹吧！那些销魂的古代欧洲建筑图纸,editor tingyu柯布西耶曾说，照相机阻挡了观察。相机既无需对事物作高度的选择，...,http://www.chinabuildingcentre.com/show-41-679-1.html
谈之为竹，构之以情——Peter Lynch分享竹子作为建构材料的纯与不纯,竹子之于我们的生活可谓无处不在。苏轼就曾发出无竹令人俗感慨。如今，竹材研究被...,http://www.chinabuildingcentre.com/show-41-678-1.html
从西方概念到全球意识——方振宁十问雷姆·库哈斯,编辑   刘婷玉方振宁：记得你在1995 年于东京举行了你和OMA 的展览，对东京以...,http://www.chinabuildingcentre.com/show-41-677-1.html
遂心，随性——周榕对话李兴钢,编辑   赵迪关乎思想资源周榕 ：刚写完一篇有关兴钢作品的评论，在写作过程中...,http://www.chinabuildingcentre.com/show-41-676-1.html
李兴钢与周榕十问友朋,编辑   赵迪论十年，能见证事务所的稳步发展，可回顾建筑师的摸索奋进；论胜景...,http://www.chinabuildingcentre.com/show-41-675-1.html
OMA 在中国 ：与“文化误区”和谐共处,文   Roberto Requejo OMA 高级建筑师多面中国在中国工作会面临多种情况 ：...,http://www.chinabuildingcentre.com/show-41-674-1.html
OMA 在韩国 ：逆境中的事业,文   Yunhee Jeong OMA高级建筑师韩国的经济发展计划在 20 世纪 60 年代...,http://www.chinabuildingcentre.com/show-41-673-1.html
OMA 在东南亚 ：机遇与挑战并存,文   Michael Kokora OMA 协理东南亚的魅力令人难以抗拒，美丽的自然风光、...,http://www.chinabuildingcentre.com/show-41-672-1.html
OMA 在澳大利亚 ：澳大利亚文脉与非传统项目采购法,文   Ricky Suen OMA 建筑师澳大利亚是世界上最富有、中产阶级财富和人均财...,http://www.chinabuildingcentre.com/show-41-671-1.html
深挖亚洲文脉，致力本土设计——大卫·希艾莱特与刘珩对谈,大卫·希艾莱特(David Gianotten)大卫·希艾莱特(David Gianotten)于2008年加入O...,http://www.chinabuildingcentre.com/show-41-670-1.html
“建筑·城市·文化”研究激发创作灵感,凡事预则立——建筑·城市·文化研究激发创作灵感文   大卫·希艾莱特 OMA合伙...,http://www.chinabuildingcentre.com/show-41-669-1.html
一如体玄，兀尔忘缘——姚仁喜的建筑禅意,文 婷玉 摄影 谭唯一7月26日，台湾建筑大师姚仁喜先生走进中国建筑设计研究院和...,http://www.chinabuildingcentre.com/show-41-668-1.html
姚任祥：跟姚先生工作就像打乒乓,受访人   姚任祥 姚仁喜夫人，姚仁喜 | 大元建筑工场资深合伙人采访人   ...,http://www.chinabuildingcentre.com/show-41-667-1.html
赵晓农：跟姚先生开会一定要带上“文房四宝”,受访人   赵晓农 会元设计咨询（上海）有限公司合伙人、建筑总经理采访人  ...,http://www.chinabuildingcentre.com/show-41-666-1.html
天使，可以同时身在两地！,文   阮庆岳 元智大学 艺术与设计学系教授原文刊载于《ARCHITEECTURE OF KR...,http://www.chinabuildingcentre.com/show-41-665-1.html
将心灵能量转化成建筑,文   陈宛茜 联合报建筑专栏采访记者德国建筑学者麦耶（Ulf Meyer），2012 ...,http://www.chinabuildingcentre.com/show-41-664-1.html
大元建筑的几何诗性,文   王俊雄 （实践大学建筑学系副教授，台湾建筑杂志总编辑）秩序井然的几何...,http://www.chinabuildingcentre.com/show-41-663-1.html
涵泳摩登，究竟涅槃——法鼓山农禅寺鉴照,文   周榕 （清华大学建筑学院副教授、著名评论家）摩登禅性建筑师姚仁喜有两...,http://www.chinabuildingcentre.com/show-41-662-1.html
程泰宁：“艺术范儿”的建筑师姚先生,受访人   程泰宁 中国工程院院士、中联筑境建筑设计有限公司主持人采访人、编...,http://www.chinabuildingcentre.com/show-41-661-1.html
建筑是人类情感的容器——UED专访姚仁喜,采访、编辑   康娟我对于怎样创造一个空间去支撑人类日常活动中的故事特别感兴...,http://www.chinabuildingcentre.com/show-41-660-1.html
镜子里外都是镜子——西方人笔下的中国建筑之二：小屋之美,和辻哲郎曾说：“‘家’不仅仅是木材和泥土的堆积，同时表达着人类的存在。”住宅...,http://www.chinabuildingcentre.com/show-41-659-1.html
镜子里外都是镜子——西方人笔下的中国建筑,对于西方人来说，中国一直是一个神秘的异境。虽说中国的存在很早就为西洋所知，但...,http://www.chinabuildingcentre.com/show-41-657-1.html
青纱红灯里穿梭的年华：旧房改造里的补色残像,文 婷玉 来源 UED官方微信一个仅有10平方米的细长的办公室，将其分成两间，从入...,http://www.chinabuildingcentre.com/show-41-656-1.html
吉村靖孝旅舍小品之二：锯南的青年旅舍,来源 UED官方微信锯南青年旅舍建于2012年，坐落于日本千叶县，面朝东京湾。5幢别...,http://www.chinabuildingcentre.com/show-41-655-1.html
入江正之：实验装置MASIA,高迪哥特式建筑原型的创作加工是建立在他对研究加泰罗尼亚地区风格的热情上的。他...,http://www.chinabuildingcentre.com/show-41-654-1.html
人云亦云的前提——今井兼次的圣堂,今井兼次生于1895年，卒于1987年，自早稻田大学理工学部建筑学科毕业后，1938年至1...,http://www.chinabuildingcentre.com/show-41-653-1.html
子之燕居，申申如也——吉村靖孝的佐岛“乌有之乡”,《论语・述而》：“子之燕居，申申如也，夭夭如也。”“申申”、“夭夭”，均为和...,http://www.chinabuildingcentre.com/show-41-652-1.html
高迪的日本粉丝团,建筑大师高迪辞世，已暌违近百年了。高迪被葬在圣家族教堂的地下墓室。他的作品都...,http://www.chinabuildingcentre.com/show-41-651-1.html
西单大悦城：核心商圈上的“国际青年城”,——专访锦绣天地总经理，原西单大悦城推广总监韩继志采访 付蓉  整理 梁兴芳...,http://www.chinabuildingcentre.com/show-41-644-1.html
华润五彩城：着眼未来的“超定位”商业地产开发,——专访华润&bull;五彩城管理中心总经理祝林采访 付蓉 整理 梁兴芳 摄影 高...,http://www.chinabuildingcentre.com/show-41-643-1.html
地域性自然——对王向荣的采访,《城市环境设计》（以下简称UED）：请您谈谈您的设计理念及文化核心。 王：首先，...,http://www.chinabuildingcentre.com/show-41-642-1.html
伊东丰雄：建筑界会复兴“自然亲近”风格,作为一名建筑师，你理想中的居所是什么样的？【伊东丰雄】我之前居住的是银色小屋(...,http://www.chinabuildingcentre.com/show-41-640-1.html
城市的未来,作者／丹尼尔·里伯斯金翻译／唐笑原文刊载于／英国《金融时报》，2010年9月7日每...,http://www.chinabuildingcentre.com/show-41-639-1.html
追寻那种迥然不同的神秘力量,——重读《破土：生活与建筑的冒险》文／李向北1967年5月生于四川成都重庆大学艺术...,http://www.chinabuildingcentre.com/show-41-638-1.html
一篇和建筑无关的文字,文／钱源 万科万创设计管理中心研发总监一直不知如何落笔所以几乎在编辑不断催促...,http://www.chinabuildingcentre.com/show-41-637-1.html
丹尼尔·里伯斯金：回顾、进程与未来,"原文刊载于Designboom, 2013年2月18日翻译／韩苗Designboom(DB)Daniel Libeskind...",http://www.chinabuildingcentre.com/show-41-636-1.html
绘画即研究——专访丹尼尔·里伯斯金,采访人／钟善、康娟翻译／钟善在中国的实践UED：香港城市大学创意媒体中心是你在中...,http://www.chinabuildingcentre.com/show-41-635-1.html
关于丹尼尔·里伯斯金,文字提供／丹尼尔·里伯斯金工作室丹尼尔·里伯斯金一直致力于不断扩大建筑的疆域...,http://www.chinabuildingcentre.com/show-41-634-1.html
寻求行业的变革与未来——“不同立场下的建筑学”研讨纪实,Edit_李慧 缴平 Photography_高文仲主办单位：《城市&bull;环境&bull;设计》（UE...,http://www.chinabuildingcentre.com/show-41-633-1.html
【UED大师讲堂-布莱登·麦克法兰】访谈-建筑与河流的对话,布兰登&bull;麦克法兰（Brandan MacFarlane）来自法国当红的建筑师组合雅各布+麦...,http://www.chinabuildingcentre.com/show-41-632-1.html
【新周刊】细胞城市里的民主建筑,忘掉自己是城市细胞一部分的建筑无法经受时间的考验，不管它在结构上是多么的出色...,http://www.chinabuildingcentre.com/show-41-631-1.html
【创新思维】材•艺——Arup Associates材料之美,作为表达建筑与环境引力的独特部件，建筑表皮因建筑日益明显的多元化趋势，获得了...,http://www.chinabuildingcentre.com/show-41-630-1.html
【绿色先锋】Arup Associates的科技园区设计,在Arup Associates50年的发展历程中，从最初的建筑师与工程师互相合作，到如今的...,http://www.chinabuildingcentre.com/show-41-629-1.html
【一体化设计】一体化设计之源——探秘Arup Associates团队（三）,UED以建筑专业媒体视角深入Arup Associates团队，为您解读全球Arup Associates跨...,http://www.chinabuildingcentre.com/show-41-628-1.html
建筑是我的生活，更是我的所爱—Archdaily专访人道主义建筑师坂茂,坂茂的全部作品不仅仅呈现了他善良的初衷，都体现了创意的思维模式及革新的设计理...,http://www.chinabuildingcentre.com/show-41-627-1.html
大脚的革命：我的新美学思想与新景观实践,文 俞孔坚1 小脚 大脚：中国传统审美观和可持续性在将近一千年的时间里，中国的...,http://www.chinabuildingcentre.com/show-41-626-1.html
坂茂：不热爱橄榄球的木匠不是好建筑师,坂茂成长于艺术之家坂茂1957年8月5日出生于东京，父亲是丰田公司的业务人员，母亲...,http://www.chinabuildingcentre.com/show-41-625-1.html
责任与关怀：2014年普利兹克建筑奖获奖者坂茂的评语,自三十五年前设立以来，普利兹克建筑奖的宗旨一直都是表彰当代在世建筑师的杰出建...,http://www.chinabuildingcentre.com/show-41-624-1.html
Arup Associates五十周年上海站展览活动议程,延续的特性（SUSTAINING IDENTITY）即将来到上海！延续的特性是Arup Associates...,http://www.chinabuildingcentre.com/show-41-623-1.html
【一体化设计】一体化设计之源——探秘Arup Associates团队（二）,吴嘉伟︳Arup Associates东亚建筑总监：Arup Associates1963年成立，进入中国已...,http://www.chinabuildingcentre.com/show-41-622-1.html
【绿色先锋】打造建筑的“绿肺”Arup Associates的幕墙设计,提高自然能源在建筑中的使用率，有效的使构筑空间、城市、自然环境更好的融合，是...,http://www.chinabuildingcentre.com/show-41-621-1.html
【创新思维】情•艺 ARUP ASSOCIATES秉承的人文关怀,台湾教育建筑学者汉宝德先生曾说过，人性的空间就是人人都感到温暖的空间。Arup A...,http://www.chinabuildingcentre.com/show-41-620-1.html
人法天工——站在建筑史门槛上的李兴钢,文 周榕零·共看明月皆如此一道门槛，把绝大多数建筑师隔绝在建筑史之外。建筑是...,http://www.chinabuildingcentre.com/show-41-618-1.html
胜景几何,文 李兴钢关于人工与自然虽然人类的文化都封闭于地球这一星体，但中西方文化的确...,http://www.chinabuildingcentre.com/show-41-619-1.html
李兴钢建筑作品对话会,时间：2013年10月25日周五10:00地点：北京车公庄大街19号中国建筑设计研究院主办单...,http://www.chinabuildingcentre.com/show-41-617-1.html
始终如一的“一体化设计”——Arup Associates的发展历程,如果建筑师能够深入地进行设计，而不流于建筑的表面修饰，那么他将创造出伟大的建...,http://www.chinabuildingcentre.com/show-41-616-1.html
Arup Associates五十周年庆典全球巡展上海站即将开幕,完美融合艺术与科学 大胆诠释行业新标准——Arup Associates五十周年庆典全球巡...,http://www.chinabuildingcentre.com/show-41-615-1.html
【绿色先锋】ARUP ASSOCIATES不可不知的节能技术突破,历经半个世纪的光阴流传，Arup Associates犹如繁茂于国际建筑设计领域的一支常青...,http://www.chinabuildingcentre.com/show-41-614-1.html
【创新思维】技•艺——Arup Associates诠释的完美建筑,历经半个世纪的光阴流传，Arup Associates犹如繁茂于国际建筑设计领域的一支常青...,http://www.chinabuildingcentre.com/show-41-613-1.html
【一体化设计】一体化设计之源——探秘Arup Associates团队（一）,UED：Arup Associates团队是如何区别于传统建筑工作模式，怎样展开一个项目的设计...,http://www.chinabuildingcentre.com/show-41-612-1.html
隈研吾呼吁建筑师应该懂得“谦逊”,海啸让我们发现：与自然力量相比，我们是如此软弱在2011年日本大海啸的周年纪念会...,http://www.chinabuildingcentre.com/show-41-611-1.html
以景观都市主义的理念解构城镇化,淮海路、新天地、田子坊簇拥下的思南公馆散发着浓厚的人文历史底蕴，在这片融古贯...,http://www.chinabuildingcentre.com/show-41-610-1.html
有温度的建构：超现实主义建筑师藤森照信,一座环绕在樱花树丛中以单脚支撑的茶室展现出日本建筑师藤森照信（Fujimori Terun...,http://www.chinabuildingcentre.com/show-41-609-1.html
丹·罗斯加德：科技如诗,丹·罗斯加德当雾霾频频侵袭中国各个省份之时，荷兰新锐建筑师、艺术家——丹·罗...,http://www.chinabuildingcentre.com/show-41-607-1.html
深圳宝安机场：蜂巢的窗，蕾丝的光,深圳宝安机场T3号楼设计效果图点!点!点!被网友调侃密集恐惧症勿进的深圳宝安机场T3...,http://www.chinabuildingcentre.com/show-41-605-1.html
直击人心的品牌重建过程——瑞士奥林匹克博物馆,自2007年瑞士奥林匹克因整修而关闭到今年的重新对外开放已有7年之久。走进博物馆，...,http://www.chinabuildingcentre.com/show-41-604-1.html
马岩松：建筑就是要天马行空,2006年，马岩松凭借加拿大多伦多梦露大厦的设计一举成名，成为首位在国外赢得重大...,http://www.chinabuildingcentre.com/show-41-603-1.html
